{
  "$schema": "./business-access.schema.json",
  "schemaVersion": "2.0.0",
  "updatedAt": "",
  "status": "not_started",
  "founderModel": {
    "assumedExperience": "beginner",
    "agentRole": "business_operator",
    "interactionMode": "plain_language_one_step_at_a_time",
    "questionMode": "ask_user_question_when_available",
    "founderOwnsBusiness": true,
    "agentDrivesExecution": true,
    "neverDumpChecklist": true,
    "currentPhase": {
      "id": "phase_0_orient",
      "label": "Set the foundation",
      "outcome": "A clear working identity and the next safe setup step."
    },
    "activeFounderGate": {
      "id": "confirm-working-name",
      "actionType": "confirmation",
      "target": "working business or app name",
      "gateClass": "scope",
      "origin": "skill_requirement",
      "phase": {
        "id": "phase_0_orient",
        "label": "Set the foundation",
        "outcome": "A clear working identity and the next safe setup step."
      },
      "whatThisIs": "Establish the founder-owned business identity that every account will use.",
      "whyNow": "It prevents scattered personal logins and makes later operator access revocable.",
      "definitions": [],
      "founderAction": "Tell me the working business or app name you want to use; I will explain and handle the rest one step at a time.",
      "question": {
        "header": "Working name",
        "prompt": "Tell me the working business or app name you want to use; I will explain and handle the rest one step at a time.",
        "options": [
          {
            "id": "choose_working_name",
            "label": "Choose a name",
            "route": "proceed",
            "description": "Use a working name now so account and product research can stay organized.",
            "consequence": "The name remains provisional until collision and storefront checks are complete.",
            "agentActionNext": "Inspect current repo and public identity state, then guide the first secure business account step.",
            "evidenceEffect": "We can keep moving with a working name and change it later.",
            "recommended": true
          },
          {
            "id": "decide_later",
            "label": "Decide later",
            "route": "defer",
            "description": "Keep the name open while the agent continues work that does not depend on public identity.",
            "consequence": "Account creation and public naming remain blocked, but reversible product inspection continues.",
            "agentActionNext": "Continue repo and product-state inspection without creating identity-bound accounts or public assets.",
            "evidenceEffect": "Naming stays unfinished, so we cannot call this part done yet.",
            "recommended": false
          }
        ]
      },
      "bypassPolicy": {
        "mode": "fallback_allowed",
        "optionId": "decide_later",
        "reason": "A working name can be deferred because private, reversible discovery does not depend on it.",
        "fallbackAction": "Continue private product and repo discovery without creating identity-bound accounts.",
        "revisitTrigger": "Before creating public accounts, buying a domain, or locking store metadata."
      },
      "safeWorkWhileWaiting": "Continue read-only repo and product-state inspection; do not infer consent or create public identity assets.",
      "agentActionNext": "Inspect current repo and public identity state, then guide the first secure business account step.",
      "successProof": "Business identity and the next account are recorded in BUSINESS_ACCESS.md and this ledger.",
      "lifecycle": {
        "status": "pending",
        "presentedAt": "",
        "supersedesGateId": ""
      }
    },
    "gateHistory": [],
    "nextFounderAction": "Tell me the working business or app name you want to use; I will explain and handle the rest one step at a time.",
    "nextAgentAction": "Inspect current repo and public identity state, then guide the first secure business account step.",
    "nextBusinessOperation": "Once we have a working name, I move on to secure account setup, market research, your social profiles, content, support, analytics, store work, and launch, in that order."
  },
  "security": {
    "delegatedAccessFirst": true,
    "oauthBeforeSharedCredentials": true,
    "noPasswordsInChatOrRepo": true,
    "dopplerForAutomationSecretsNotBrowserPasswords": true,
    "founderControlsRecovery": true,
    "founderControlsMfa": true,
    "separateOperatorIdentityWhenPossible": true,
    "accessIsRevocable": true
  },
  "doppler": {
    "status": "not_started",
    "statusReason": "",
    "cliVersion": "",
    "docsCheckedAt": "",
    "authenticatedAccountLabel": "",
    "workspaceOwner": "founder",
    "operatorIdentityLabel": "",
    "operatorRole": "",
    "authenticationMethod": "not_selected",
    "recoveryOwner": "founder",
    "mfaOwner": "founder",
    "revocationPath": "",
    "project": "",
    "configs": [],
    "secretNames": [],
    "proofPath": "",
    "nextFounderAction": "Approve Doppler setup or complete the browser login when the agent opens it; never paste a token in chat.",
    "nextAgentAction": "Refresh official docs and CLI help, verify authentication, then inventory or create the business project and configs."
  },
  "accounts": [
    {
      "id": "business_email",
      "kind": "support",
      "platform": "Business email",
      "purpose": "Founder-owned identity and recovery spine",
      "status": "not_evaluated",
      "statusReason": "",
      "exactAccount": "",
      "businessAsset": "",
      "owner": "founder",
      "accessMethod": "not_selected",
      "operatorIdentityLabel": "",
      "operatorRole": "",
      "delegatedBy": "",
      "revocationPath": "",
      "delegationGapReason": "",
      "tokenScopeSource": "",
      "rotationOrExpiry": "",
      "grantedScopes": [],
      "canObserve": false,
      "canDraft": false,
      "canPublish": false,
      "canReply": false,
      "canModerate": false,
      "canViewAnalytics": false,
      "canSpend": false,
      "canChangeIdentity": false,
      "canDelete": false,
      "approvalRequired": true,
      "recoveryOwner": "founder",
      "mfaOwner": "founder",
      "secretNames": [],
      "checkedAt": "",
      "proofPath": "",
      "nextFounderAction": "Confirm whether a founder-owned business email already exists.",
      "nextAgentAction": "Guide creation or secure the existing account, then use it for business assets.",
      "limitations": []
    },
    {
      "id": "domain",
      "kind": "infrastructure",
      "platform": "Domain and DNS",
      "purpose": "Public identity, email, landing, and verification",
      "status": "not_evaluated",
      "statusReason": "",
      "exactAccount": "",
      "businessAsset": "",
      "owner": "founder",
      "accessMethod": "not_selected",
      "operatorIdentityLabel": "",
      "operatorRole": "",
      "delegatedBy": "",
      "revocationPath": "",
      "delegationGapReason": "",
      "tokenScopeSource": "",
      "rotationOrExpiry": "",
      "grantedScopes": [],
      "canObserve": false,
      "canDraft": false,
      "canPublish": false,
      "canReply": false,
      "canModerate": false,
      "canViewAnalytics": false,
      "canSpend": false,
      "canChangeIdentity": false,
      "canDelete": false,
      "approvalRequired": true,
      "recoveryOwner": "founder",
      "mfaOwner": "founder",
      "secretNames": [],
      "checkedAt": "",
      "proofPath": "",
      "nextFounderAction": "Approve a domain purchase only after the agent checks the working name and availability.",
      "nextAgentAction": "Research availability and prepare the narrow purchase/DNS step when needed.",
      "limitations": []
    },
    {
      "id": "apple",
      "kind": "store",
      "platform": "Apple Developer and App Store Connect",
      "purpose": "iOS ownership, TestFlight, and App Store distribution",
      "status": "not_evaluated",
      "statusReason": "",
      "exactAccount": "",
      "businessAsset": "",
      "owner": "founder",
      "accessMethod": "not_selected",
      "operatorIdentityLabel": "",
      "operatorRole": "",
      "delegatedBy": "",
      "revocationPath": "",
      "delegationGapReason": "",
      "tokenScopeSource": "",
      "rotationOrExpiry": "",
      "grantedScopes": [],
      "canObserve": false,
      "canDraft": false,
      "canPublish": false,
      "canReply": false,
      "canModerate": false,
      "canViewAnalytics": false,
      "canSpend": false,
      "canChangeIdentity": false,
      "canDelete": false,
      "approvalRequired": true,
      "recoveryOwner": "founder",
      "mfaOwner": "founder",
      "secretNames": [],
      "checkedAt": "",
      "proofPath": "",
      "nextFounderAction": "Confirm whether an Apple Developer account exists when iOS distribution is in scope.",
      "nextAgentAction": "Inspect ASC access, explain any enrollment gate, and continue the store setup.",
      "limitations": []
    },
    {
      "id": "google",
      "kind": "store",
      "platform": "Google and Play Console",
      "purpose": "Android distribution and YouTube ownership spine",
      "status": "not_evaluated",
      "statusReason": "",
      "exactAccount": "",
      "businessAsset": "",
      "owner": "founder",
      "accessMethod": "not_selected",
      "operatorIdentityLabel": "",
      "operatorRole": "",
      "delegatedBy": "",
      "revocationPath": "",
      "delegationGapReason": "",
      "tokenScopeSource": "",
      "rotationOrExpiry": "",
      "grantedScopes": [],
      "canObserve": false,
      "canDraft": false,
      "canPublish": false,
      "canReply": false,
      "canModerate": false,
      "canViewAnalytics": false,
      "canSpend": false,
      "canChangeIdentity": false,
      "canDelete": false,
      "approvalRequired": true,
      "recoveryOwner": "founder",